{
 "matches_published": null,
 "problems": [],
 "published_results_sha256": null,
 "results": {
  "canonical": true,
  "changed": {
   "blocks_with_changed_transactions": 6433,
   "coinbase_total_output": 420,
   "fee": 31569,
   "input_count": 24984,
   "output_count": 7492,
   "total_input": 24984,
   "total_output": 7492,
   "transactions": 31989
  },
  "clustering_edges": {
   "after": {
    "with_coinjoin_filter": 6274,
    "without_coinjoin_filter": 6278
   },
   "before": {
    "with_coinjoin_filter": 6274,
    "without_coinjoin_filter": 6278
   }
  },
  "clustering_input_sets_changed": {
   "multi_input_address_set": {
    "with_coinjoin_filter": 0,
    "without_coinjoin_filter": 0
   },
   "spark_regular_inputs": {
    "with_coinjoin_filter": 0,
    "without_coinjoin_filter": 0
   }
  },
  "coinjoin_flags": {
   "after": 4,
   "before": 4,
   "false_to_true": 0,
   "flagged_transactions": {
    "after": [
     "8ab78bc493bacf86ea4246913a0687affd1b45879742e6a0bed3b7b120c23d17",
     "129de7245f156966c998e386333d4d608d0cea5c243378a9b2d0544ab28038a0",
     "7aedb15d101e80ac8d9c6f91c06770b89d617658d7564254b98072ae0084a4d8",
     "47515e68bf495d190effa7e185103166890677d01a30c5fa26585ebe8fdac39c"
    ],
    "before": [
     "8ab78bc493bacf86ea4246913a0687affd1b45879742e6a0bed3b7b120c23d17",
     "129de7245f156966c998e386333d4d608d0cea5c243378a9b2d0544ab28038a0",
     "7aedb15d101e80ac8d9c6f91c06770b89d617658d7564254b98072ae0084a4d8",
     "47515e68bf495d190effa7e185103166890677d01a30c5fa26585ebe8fdac39c"
    ]
   },
   "true_to_false": 0
  },
  "differences_explained": {
   "examples": [],
   "unexplained": 0
  },
  "fees_of_non_coinbase_transactions": {
   "after": {
    "negative": 0,
    "zero": 0
   },
   "before": {
    "negative": 9748,
    "zero": 15233
   }
  },
  "newly_accounted": {
   "ironwood": {
    "into_pool": 14517897589055,
    "out_of_pool": 9466673423837,
    "transactions": 31810
   },
   "orchard": {
    "into_pool": 0,
    "out_of_pool": 2616596254014,
    "transactions": 696
   }
  },
  "range": {
   "blocks": 10000,
   "end": 3517999,
   "start": 3508000
  },
  "records_sha256": {
   "after": "ad3634288a11a0a98081ee774d6c473bded5756bab72ccfb6ed26e63a86ad411",
   "before": "4063a47ec262fec672ec214489428c6c3a5dea91a50b964a779a12915bc6d9ff"
  },
  "relation_estimates": {
   "absolute_change": 240893228,
   "estimated_value_after_of_changed": 574019159,
   "estimated_value_before_of_changed": 814912387,
   "largest_change": 239985005,
   "pairs_after": 117280,
   "pairs_before": 117280,
   "pairs_changed": 6,
   "pairs_only_after": 0,
   "pairs_only_before": 0,
   "transactions_with_changed_pairs": 6
  },
  "revisions": {
   "after": {
    "found": {
     "files": {
      "graphsenselib/ingest/rpc_eth.py": {
       "git_blob": "044d24009345fcc01fccd89b7606fb0617729013",
       "sha256": "467822eb5064cbc3d3b3dabb615f27ac005abd813618b533729ccc4cacff930d"
      },
      "graphsenselib/ingest/rpc_utxo.py": {
       "git_blob": "63f5453950251f15d4a909c7a7eff556adf4dbbc",
       "sha256": "e694c87787d7f6b82fc19dd62f6b64b1d998d63cbec61bcc9dac08749ff707ba"
      },
      "graphsenselib/ingest/transform.py": {
       "git_blob": "f27dbe31c59bf52c0714dd28970c0dc92cf863a2",
       "sha256": "38ab7237e3cabd40155a9c2575fefe6b9c8530c79d1595f07631c2e496ee4684"
      },
      "graphsenselib/ingest/utxo.py": {
       "git_blob": "8f927d5262eac20ac6cbf68acdd4c71193a4a407",
       "sha256": "5f676cd2d91c466fd47a01c5e1ef978684bd4bb8fcba50c624f7dd2afbdb273c"
      },
      "graphsenselib/utils/pubkey_to_address.py": {
       "git_blob": "b7330be5a8cf4ec25feda69cfb9b897e71472a3e",
       "sha256": "25f4908f95e197e058f9ca235af69a2677bfd9832bf1a3b74c3639e6286fbe1c"
      }
     },
     "package_file_count": 353,
     "package_tree_sha256": "675521888b904da1b953afe786334b762098d96df67c8c2392d1467d0d2f4b6f"
    },
    "is_pinned_code": true,
    "pinned": {
     "git_commit": "411b987a0f246943d4ee70421f43b17a3cba8f8c",
     "package_tree_sha256": "675521888b904da1b953afe786334b762098d96df67c8c2392d1467d0d2f4b6f",
     "version": "2.16.4"
    }
   },
   "before": {
    "found": {
     "files": {
      "graphsenselib/ingest/rpc_eth.py": {
       "git_blob": "044d24009345fcc01fccd89b7606fb0617729013",
       "sha256": "467822eb5064cbc3d3b3dabb615f27ac005abd813618b533729ccc4cacff930d"
      },
      "graphsenselib/ingest/rpc_utxo.py": {
       "git_blob": "1ad7ca79e1e3c14dd34d078f472b51435802d273",
       "sha256": "91dc581c52474ccc7c16491902b79d04a45be408ed27506569eab13ced55e6b2"
      },
      "graphsenselib/ingest/transform.py": {
       "git_blob": "f27dbe31c59bf52c0714dd28970c0dc92cf863a2",
       "sha256": "38ab7237e3cabd40155a9c2575fefe6b9c8530c79d1595f07631c2e496ee4684"
      },
      "graphsenselib/ingest/utxo.py": {
       "git_blob": "8f927d5262eac20ac6cbf68acdd4c71193a4a407",
       "sha256": "5f676cd2d91c466fd47a01c5e1ef978684bd4bb8fcba50c624f7dd2afbdb273c"
      },
      "graphsenselib/utils/pubkey_to_address.py": {
       "git_blob": "b7330be5a8cf4ec25feda69cfb9b897e71472a3e",
       "sha256": "25f4908f95e197e058f9ca235af69a2677bfd9832bf1a3b74c3639e6286fbe1c"
      }
     },
     "package_file_count": 354,
     "package_tree_sha256": "4bb3029346d707d19d9c63a53a60ec1c27a11066d0b782d5451fe751e09132c4"
    },
    "is_pinned_code": true,
    "pinned": {
     "git_commit": "c02cbdb544fe25daf4bef5d4a14cb455608253f3",
     "package_tree_sha256": "4bb3029346d707d19d9c63a53a60ec1c27a11066d0b782d5451fe751e09132c4",
     "version": "2.16.3"
    }
   }
  },
  "summary_format": 1,
  "tool": {
   "name": "gs-zec-validate",
   "version": "1.1.0"
  },
  "transactions": {
   "coinbase": 10000,
   "non_coinbase": 58790,
   "total": 68790
  },
  "unresolved_inputs": {
   "after": 0,
   "before": 0
  }
 },
 "results_sha256": "46c20e23d3cfbd97e9123746eb749a2c9ce5e7788f4eb37fa6941ecf48df684f",
 "run": {
  "graphsense_lib_versions": {
   "after": "2.16.4",
   "before": "2.16.3"
  },
  "node": "/Zebra:6.4.2/",
  "platform": "Linux x86_64",
  "python": "3.12.3",
  "seconds": 229,
  "started_utc": "2026-10-15T16:42:26Z",
  "worker_answers": {
   "after": {
    "getblock": 10000,
    "getblockhash": 10000,
    "getrawtransaction": 41380
   },
   "before": {
    "getblock": 10000,
    "getblockhash": 10000,
    "getrawtransaction": 41380
   }
  }
 },
 "verdict": "pass"
}
